Name,Subclass,Url,Division,Retailer
Action camera 4K Outdoor Sports Ultra HD 606481 black,"Equipment for the reception, recording and reproduction of sound and vision",/products/sound-and-vision/action-cameras-and-accessories/action-cameras/377715,RECREATION AND CULTURE,Stephanis
Toy LEGO Vidiyo: Bandmates 43101,Toys and celebration articles,products/372619,RECREATION AND CULTURE,Stephanis
GIGA Unlimited,Bundled telecommunication services,https://primetel.com.cy/giga-unlimited,COMMUNICATION,Primetel
GIGA Unlimited Plus,Bundled telecommunication services,https://primetel.com.cy/giga-unlimited,COMMUNICATION,Primetel
GIGA Unlimited MAX,Bundled telecommunication services,https://primetel.com.cy/giga-unlimited,COMMUNICATION,Primetel
NescafeGoldBlend50g,Coffee,nescafe-gold-blend-50g,FOOD AND NON-ALCOHOLIC BEVERAGES,SupermarketCy
"Kykkos6X1,5L",Mineral or spring waters,kykkos-6ch15l,FOOD AND NON-ALCOHOLIC BEVERAGES,SupermarketCy
Ετήσιο Τέλος,Sewage collection,https://eoal.org.cy/exypiretisi/teli/apocheteftika-teli/,"HOUSING, WATER, ELECTRICITY, GAS AND OTHER FUELS",Sewerage Board of Larnaca
Τέλος Χρήσης,Sewage collection,https://eoal.org.cy/exypiretisi/teli/apocheteftika-teli/,"HOUSING, WATER, ELECTRICITY, GAS AND OTHER FUELS",Sewerage Board of Larnaca
