Name,Subclass,Url,Division,Retailer
Νουνού400g,Other milk products,nounou-400g,FOOD AND NON-ALCOHOLIC BEVERAGES,SupermarketCy
NeutroRobertsDeodorantPowderFreshRollOn50ml,"Articles for personal hygiene and wellness, esoteric products and beauty products",neutro-roberts-deodorant-powder-fresh-roll-on-50ml,MISCELLANEOUS GOODS AND SERVICES,SupermarketCy
VikosNero12X500ml,Mineral or spring waters,vikos-nero-12x500ml,FOOD AND NON-ALCOHOLIC BEVERAGES,SupermarketCy
Ετήσιο Τέλος,Sewage collection,https://eoal.org.cy/exypiretisi/teli/apocheteftika-teli/,"HOUSING, WATER, ELECTRICITY, GAS AND OTHER FUELS",Sewerage Board of Larnaca
Τέλος Χρήσης,Sewage collection,https://eoal.org.cy/exypiretisi/teli/apocheteftika-teli/,"HOUSING, WATER, ELECTRICITY, GAS AND OTHER FUELS",Sewerage Board of Larnaca
