Name,Subclass,Url,Division,Retailer
Μηχανικό μολύβι 0.5 λιλά χρώμα,Other stationery and drawing materials,https://www.parga.com.cy/el/grafiki-uli-analosima/-mixaniko-moluvi-05-lila-xroma-114446#sthash.QQDkSC0Z.dpbs,RECREATION AND CULTURE,Parga
Σετ highlighter Fluo Peps - 4 χρώματα,Other stationery and drawing materials,https://www.parga.com.cy/el/grafiki-uli-analosima/-set-highlighter-fluo-peps-4-xromata#sthash.XiPbkH7M.dpbs,RECREATION AND CULTURE,Parga
NescafeGoldBlend50g,Coffee,nescafe-gold-blend-50g,FOOD AND NON-ALCOHOLIC BEVERAGES,SupermarketCy
Fanta6X330ml,Soft drinks,fanta-6x330ml-1,FOOD AND NON-ALCOHOLIC BEVERAGES,SupermarketCy
"Kykkos6X1,5L",Mineral or spring waters,kykkos-6ch15l,FOOD AND NON-ALCOHOLIC BEVERAGES,SupermarketCy
Ετήσιο Τέλος,Sewage collection,https://eoal.org.cy/exypiretisi/teli/apocheteftika-teli/,"HOUSING, WATER, ELECTRICITY, GAS AND OTHER FUELS",Sewerage Board of Larnaca
Τέλος Χρήσης,Sewage collection,https://eoal.org.cy/exypiretisi/teli/apocheteftika-teli/,"HOUSING, WATER, ELECTRICITY, GAS AND OTHER FUELS",Sewerage Board of Larnaca
